<?xml version="1.0" encoding="UTF-8"?>
<!DOCTYPE Library SYSTEM "Library.dtd">
<Library>
	<Book>BookId
		<title></title>
		<Author></Author>
		<Publisher></Publisher>
		<Cost></Cost>
	</Book>
	<Memeber>
		<Name>
			<FirstName></FirstName>
			<MiddleName></MiddleName>
			<LastName></LastName>
		</Name>
		<Address>
			<HouseNumber></HouseNumber>
			<Street></Street>
			<City></City>
		</Address>
	</Memeber>
</Library>